{
  "$schema": "../../../packages/song-map/schema/song-map.schema.json",
  "schemaVersion": "1.0.0",
  "id": "poc-test-song",
  "title": "PoC test song (placeholder)",
  "artist": "LingoLyrics team",
  "language": "ja",
  "audio": {
    "file": "poc-test-song.wav",
    "durationMs": 84000
  },
  "rights": {
    "lyrics": {
      "license": "PLACEHOLDER",
      "source": "team-written modern Japanese lyrics, pending"
    },
    "audio": {
      "license": "PLACEHOLDER",
      "source": "to be generated by scripts/gen-audio.ts in phase 4"
    }
  },
  "lines": [
    {
      "id": "l01",
      "startMs": 2000,
      "endMs": 5800,
      "text": "PLACEHOLDER line 1: team-written lyrics go here"
    },
    {
      "id": "l02",
      "startMs": 6000,
      "endMs": 9800,
      "text": "PLACEHOLDER line 2: team-written lyrics go here"
    },
    {
      "id": "l03",
      "startMs": 10000,
      "endMs": 13800,
      "text": "PLACEHOLDER line 3: team-written lyrics go here"
    },
    {
      "id": "l04",
      "startMs": 14000,
      "endMs": 17800,
      "text": "PLACEHOLDER line 4: team-written lyrics go here"
    },
    {
      "id": "l05",
      "startMs": 18000,
      "endMs": 21800,
      "text": "PLACEHOLDER line 5: team-written lyrics go here"
    },
    {
      "id": "l06",
      "startMs": 22000,
      "endMs": 25800,
      "text": "PLACEHOLDER line 6: team-written lyrics go here"
    },
    {
      "id": "l07",
      "startMs": 26000,
      "endMs": 29800,
      "text": "PLACEHOLDER line 7: team-written lyrics go here"
    },
    {
      "id": "l08",
      "startMs": 30000,
      "endMs": 33800,
      "text": "PLACEHOLDER line 8: team-written lyrics go here"
    },
    {
      "id": "l09",
      "startMs": 34000,
      "endMs": 37800,
      "text": "PLACEHOLDER line 9: team-written lyrics go here"
    },
    {
      "id": "l10",
      "startMs": 38000,
      "endMs": 41800,
      "text": "PLACEHOLDER line 10: team-written lyrics go here"
    },
    {
      "id": "l11",
      "startMs": 42000,
      "endMs": 45800,
      "text": "PLACEHOLDER line 11: team-written lyrics go here"
    },
    {
      "id": "l12",
      "startMs": 46000,
      "endMs": 49800,
      "text": "PLACEHOLDER line 12: team-written lyrics go here"
    },
    {
      "id": "l13",
      "startMs": 50000,
      "endMs": 53800,
      "text": "PLACEHOLDER line 13: team-written lyrics go here"
    },
    {
      "id": "l14",
      "startMs": 54000,
      "endMs": 57800,
      "text": "PLACEHOLDER line 14: team-written lyrics go here"
    },
    {
      "id": "l15",
      "startMs": 58000,
      "endMs": 61800,
      "text": "PLACEHOLDER line 15: team-written lyrics go here"
    },
    {
      "id": "l16",
      "startMs": 62000,
      "endMs": 65800,
      "text": "PLACEHOLDER line 16: team-written lyrics go here"
    },
    {
      "id": "l17",
      "startMs": 66000,
      "endMs": 69800,
      "text": "PLACEHOLDER line 17: team-written lyrics go here"
    },
    {
      "id": "l18",
      "startMs": 70000,
      "endMs": 73800,
      "text": "PLACEHOLDER line 18: team-written lyrics go here"
    },
    {
      "id": "l19",
      "startMs": 74000,
      "endMs": 77800,
      "text": "PLACEHOLDER line 19: team-written lyrics go here"
    },
    {
      "id": "l20",
      "startMs": 78000,
      "endMs": 81800,
      "text": "PLACEHOLDER line 20: team-written lyrics go here"
    }
  ]
}
